2026-01-16 20:56:24 | INFO | P01 | =================
2026-01-16 20:56:24 | INFO | P01 | === RUN START ===
2026-01-16 20:56:24 | INFO | P01 | project=Foundations of Professional Python
2026-01-16 20:56:24 | INFO | P01 | repo_dir=datafun-01-foundations
2026-01-16 20:56:24 | INFO | P01 | python=3.14.2
2026-01-16 20:56:24 | INFO | P01 | os=Windows 11
2026-01-16 20:56:24 | INFO | P01 | shell=powershell
2026-01-16 20:56:24 | INFO | P01 | cwd=.
2026-01-16 20:56:24 | INFO | P01 | github_actions=False
2026-01-16 20:56:24 | INFO | P01 | =================
2026-01-16 20:56:24 | INFO | P01 | START main()..................
2026-01-16 20:56:24 | INFO | P01 | Generated formatted multi-line SUMMARY string.
2026-01-16 20:56:24 | INFO | P01 | Returning the str to the calling function.
2026-01-16 20:56:24 | INFO | P01 | 
    Course Information:
        Course name: Data Analytics Fundamentals
        Course number: 608
        Course hrs/wk: 20.00
        Assumes prior experience: False
        Uses Professional Python: True
        Helpful traits: ['patience', 'curiosity', 'humor', 'tenacity']
    
2026-01-16 20:56:24 | INFO | P01 | Generated formatted multi-line SUMMARY string.
2026-01-16 20:56:24 | INFO | P01 | Returning the str to the calling function.
2026-01-16 20:56:24 | INFO | P01 | 
    Descriptive Statistics for Snowfall (inches):
        Total snowfall: 22.50 inches
        Count of measurements: 5
        Minimum snowfall: 2.50 inches
        Maximum snowfall: 6.50 inches
        Average snowfall: 4.50 inches
        Standard deviation: 1.58 inches
    
2026-01-16 20:56:24 | INFO | P01 | END main()..................
2026-01-16 20:56:41 | INFO | P01 | =================
2026-01-16 20:56:41 | INFO | P01 | === RUN START ===
2026-01-16 20:56:41 | INFO | P01 | project=Foundations of Professional Python
2026-01-16 20:56:41 | INFO | P01 | repo_dir=datafun-01-foundations
2026-01-16 20:56:41 | INFO | P01 | python=3.14.2
2026-01-16 20:56:41 | INFO | P01 | os=Windows 11
2026-01-16 20:56:41 | INFO | P01 | shell=powershell
2026-01-16 20:56:41 | INFO | P01 | cwd=.
2026-01-16 20:56:41 | INFO | P01 | github_actions=False
2026-01-16 20:56:41 | INFO | P01 | =================
2026-01-16 20:56:41 | INFO | P01 | START main()..................
2026-01-16 20:56:41 | INFO | P01 | Generated formatted multi-line SUMMARY string.
2026-01-16 20:56:41 | INFO | P01 | Returning the str to the calling function.
2026-01-16 20:56:41 | INFO | P01 | 
    Custom Information:
        Company name: DataFun Analytics
        Employee count: 150
        TODO: Add your other global variables below:





    
2026-01-16 20:56:41 | INFO | P01 | Generated formatted multi-line SUMMARY string.
2026-01-16 20:56:41 | INFO | P01 | Returning the str to the calling function.
2026-01-16 20:56:41 | INFO | P01 | 
    Descriptive Statistics for Snowfall (inches):
        Total snowfall: 22.50 inches
        TODO: Add your count of measurements below:

        TODO: Add your minimum and maximum snowfall below:

        Average snowfall: 4.50 inches
        TODO: Add your standard deviation below:

    
2026-01-16 20:56:41 | INFO | P01 | END main()..................
2026-01-16 21:18:43 | INFO | P01 | =================
2026-01-16 21:18:43 | INFO | P01 | === RUN START ===
2026-01-16 21:18:43 | INFO | P01 | project=Foundations of Professional Python
2026-01-16 21:18:43 | INFO | P01 | repo_dir=datafun-01-foundations
2026-01-16 21:18:43 | INFO | P01 | python=3.14.2
2026-01-16 21:18:43 | INFO | P01 | os=Windows 11
2026-01-16 21:18:43 | INFO | P01 | shell=powershell
2026-01-16 21:18:43 | INFO | P01 | cwd=.
2026-01-16 21:18:43 | INFO | P01 | github_actions=False
2026-01-16 21:18:43 | INFO | P01 | =================
2026-01-16 21:18:43 | INFO | P01 | START main()..................
2026-01-16 21:18:43 | INFO | P01 | Generated formatted multi-line SUMMARY string.
2026-01-16 21:18:43 | INFO | P01 | Returning the str to the calling function.
2026-01-16 21:18:43 | INFO | P01 | 
    Course Information:
        Course name: Data Analytics Fundamentals
        Course number: 608
        Course hrs/wk: 20.00
        Assumes prior experience: False
        Uses Professional Python: True
        Helpful traits: ['patience', 'curiosity', 'humor', 'tenacity']
    
2026-01-16 21:18:43 | INFO | P01 | Generated formatted multi-line SUMMARY string.
2026-01-16 21:18:43 | INFO | P01 | Returning the str to the calling function.
2026-01-16 21:18:43 | INFO | P01 | 
    Descriptive Statistics for Snowfall (inches):
        Total snowfall: 22.50 inches
        Count of measurements: 5
        Minimum snowfall: 2.50 inches
        Maximum snowfall: 6.50 inches
        Average snowfall: 4.50 inches
        Standard deviation: 1.58 inches
    
2026-01-16 21:18:43 | INFO | P01 | END main()..................
2026-01-16 21:18:48 | INFO | P01 | =================
2026-01-16 21:18:48 | INFO | P01 | === RUN START ===
2026-01-16 21:18:48 | INFO | P01 | project=Foundations of Professional Python
2026-01-16 21:18:48 | INFO | P01 | repo_dir=datafun-01-foundations
2026-01-16 21:18:48 | INFO | P01 | python=3.14.2
2026-01-16 21:18:48 | INFO | P01 | os=Windows 11
2026-01-16 21:18:48 | INFO | P01 | shell=powershell
2026-01-16 21:18:48 | INFO | P01 | cwd=.
2026-01-16 21:18:48 | INFO | P01 | github_actions=False
2026-01-16 21:18:48 | INFO | P01 | =================
2026-01-16 21:18:48 | INFO | P01 | START main()..................
2026-01-16 21:18:48 | INFO | P01 | Generated formatted multi-line SUMMARY string.
2026-01-16 21:18:48 | INFO | P01 | Returning the str to the calling function.
2026-01-16 21:18:48 | INFO | P01 | 
    Custom Information:
        Company name: DataFun Analytics
        Employee count: 150
        TODO: Add your other global variables below:





    
2026-01-16 21:18:48 | INFO | P01 | Generated formatted multi-line SUMMARY string.
2026-01-16 21:18:48 | INFO | P01 | Returning the str to the calling function.
2026-01-16 21:18:48 | INFO | P01 | 
    Descriptive Statistics for Snowfall (inches):
        Total snowfall: 22.50 inches
        TODO: Add your count of measurements below:

        TODO: Add your minimum and maximum snowfall below:

        Average snowfall: 4.50 inches
        TODO: Add your standard deviation below:

    
2026-01-16 21:18:48 | INFO | P01 | END main()..................
